<?xml version="1.0"?>
<!DOCTYPE mycat:schema SYSTEM "schema.dtd">
<mycat:schema xmlns:mycat="http://org.opencloudb/">

	<schema name="mycat" checkSQLschema="true" sqlMaxLimit="100">
		<table name="t_user" primaryKey="user_id" dataNode="dn$1-2" rule="rule1" />
        <table name="t_node" primaryKey="vid" autoIncrement="true" dataNode="dn$1-2" rule="rule1" />
		<table name="t_area" type="global" primaryKey="ID" dataNode="dn$1-2" />
        <table name="t_range_bydate" dataNode="dn$1-2" />

	</schema>

	<dataNode name="dn1" dataHost="jdbchost" database="mycat_node1" />
	<dataNode name="dn2" dataHost="jdbchost2" database="mycat_node1" />

	<dataHost name="jdbchost" maxCon="500" minCon="10" balance="1"
       writeType="0" dbType="mysql" dbDriver="native">
		<heartbeat>select 1</heartbeat>
		<writeHost host="readshard" url="121.40.121.133:3306" user="root" password="zaq1xsw2cde3">
		    <readHost host="readshard" url="116.236.223.115:3307" user="root" password="root"/>
		</writeHost>
        <!-- <writeHost host="master" url="116.236.223.116:3306" user="root" password="xrpension">
		   <readHost host="readmaster" url="116.236.223.115:3307" user="root" password="root"/>
		</writeHost> -->

	</dataHost>
	<!-- -->
	<dataHost name="jdbchost2" maxCon="500" minCon="10" balance="1"
       writeType="0" dbType="mysql" dbDriver="native">
		<heartbeat>select 1</heartbeat>
        <writeHost host="readshard" url="121.40.121.133:3306" user="root" password="zaq1xsw2cde3">
		    <readHost host="readshard" url="116.236.223.118:3306" user="dbcluster" password="xrpension!DBCluster"/>
		</writeHost>
		<!-- <writeHost host="shard" url="116.236.223.118:3306" user="dbcluster" password="xrpension!DBCluster">
		   <readHost host="readshard" url="121.40.121.133:3306" user="root" password="zaq1xsw2cde3"/>
		</writeHost> -->
        <!-- <writeHost host="master" url="116.236.223.115:3307" user="root" password="root">
		   <readHost host="readmaster" url="116.236.223.115:3307" user="root" password="root"/>
		</writeHost> -->
	</dataHost>

</mycat:schema>
