<?xml version="1.0" encoding="UTF-8"?>
<!--
 -  
 - Licensed under the Apache License, Version 2.0 (the "License");
 - you may not use this file except in compliance with the License.
 - You may obtain a copy of the License at
 -  
 -      http://www.apache.org/licenses/LICENSE-2.0
 -  
 - Unless required by applicable law or agreed to in writing, software
 - distributed under the License is distributed on an "AS IS" BASIS,
 - WITHOUT WARRANTIES OR CONDITIONS OF ANY KIND, either express or implied.
 - See the License for the specific language governing permissions and
 - limitations under the License.
-->
<!DOCTYPE mycat:schema SYSTEM "schema.dtd">
<mycat:schema xmlns:mycat="http://org.opencloudb/">

  <!-- schema定义 -->
  <schema name="dbtest">
    <table name="tb2" dataNode="dnTest2,dnTest3" rule="rule1" />
  </schema>

  <!-- 数据节点定义，数据节点由数据源和其他一些参数组织而成。 -->
  <dataNode name="dnTest1" dataHost="localhost1" database="db1" /> 
  <dataNode name="dnTest2" dataHost="localhost1" database="db2" />
  <dataNode name="dnTest3" dataHost="localhost1" database="db3" />
<dataHost name="localhost1" maxCon="500" minCon="10" balance="0"
		dbType="mysql" dbDriver="native" >
		<heartbeat>select user()</heartbeat>
		<!-- can have multi write hosts -->
		<writeHost host="hostM1" url="localhost:3306" user="root"
			password="123456">
			<!-- can have multi read hosts -->
			<!-- <readHost host="hostS1" url="localhost:3307" user="root" password="123456" 
				/> -->
		</writeHost>
	</dataHost>

 
</mycat:schema>
