<?xml version="1.0" encoding="UTF-8"?>
<!-- - - Licensed under the Apache License, Version 2.0 (the "License"); 
	- you may not use this file except in compliance with the License. - You 
	may obtain a copy of the License at - - http://www.apache.org/licenses/LICENSE-2.0 
	- - Unless required by applicable law or agreed to in writing, software - 
	distributed under the License is distributed on an "AS IS" BASIS, - WITHOUT 
	WARRANTIES OR CONDITIONS OF ANY KIND, either express or implied. - See the 
	License for the specific language governing permissions and - limitations 
	under the License. -->
<!DOCTYPE mycat:schema SYSTEM "schema.dtd">
<mycat:schema xmlns:mycat="http://io.mycat/">

	<schema name="cndb" checkSQLschema="true" >
		<table name="sqtestmonth" primaryKey="ID" dataNode="dn3,dn4" rule="sharding-by-id" />
	</schema>
	<dataNode name="dn4" dataHost="localhost1" database="db4" />
	<dataNode name="dn3" dataHost="localhost1" database="db4" />


	<dataHost name="localhost1" maxCon="500" minCon="10" balance="0"
		dbType="mysql" dbDriver="native">
		<heartbeat>select user()</heartbeat>
		<writeHost host="hostM1" url="localhost:3307" user="root" password="123456">
		</writeHost>
	</dataHost>
</mycat:schema>
