<?xml version="1.0" encoding="UTF-8"?>
<!-- - - Licensed under the Apache License, Version 2.0 (the "License"); 
	- you may not use this file except in compliance with the License. - You 
	may obtain a copy of the License at - - http://www.apache.org/licenses/LICENSE-2.0 
	- - Unless required by applicable law or agreed to in writing, software - 
	distributed under the License is distributed on an "AS IS" BASIS, - WITHOUT 
	WARRANTIES OR CONDITIONS OF ANY KIND, either express or implied. - See the 
	License for the specific language governing permissions and - limitations 
	under the License. -->
<!DOCTYPE mycat:schema SYSTEM "schema.dtd">
<mycat:schema xmlns:mycat="http://io.mycat/">

	<schema name="cndb" checkSQLschema="true" >
		<table name="offer" dataNode="offer_dn$0-127" rule="offerRule" />
		<table name="offer_detail" dataNode="detail_dn0,detail_dn$1-127"
			rule="offerDetailRule" ruleRequired="false" />
		<table name="offer_date" dataNode="detail_dn0,detail_dn$1-127"
			rule="dateRule" ruleRequired="false" />

		<table name="independent" dataNode="independent_dn$0-126,independent_dn127" />
	</schema>
	<schema name="dubbo" dataNode="dubbo_dn" />
    <schema name="dubbo2" dataNode="dn1" >
        <table name="company" type="global" dataNode="dn1,dn2,dn3" />
        <table name="goods" type="global" dataNode="dn1,dn2,dn3" />
            </schema>
	<schema name="ignoreSchemaTest" dataNode="cndb_dn" checkSQLschema="true"/>
	<schema name="config">
		<table name="offer" dataNode="offer_dn$0-127" rule="offerRule"
			ruleRequired="true" />
	</schema>
	<schema name="none_node_test">
		<table name="offer" dataNode="offer_dn$0-127" rule="offerRule"
			ruleRequired="true" />
	</schema>
	<schema name="solo1" dataNode="solo1" />

	<schema name="TESTDB"  sqlMaxLimit="100">
		<table name="travelrecord" dataNode="dn1,dn2,dn3" rule="auto-sharding-long" />
		<!-- global table is auto cloned to all defined data nodes ,so can join 
			with any table whose sharding node is in the same data node -->
		<table name="company" type="global" dataNode="dn1,dn2,dn3" />
		<table name="goods" type="global" dataNode="dn1,dn2,dn3" />
		<table name="notpartionTable"  dataNode="dn1" />
		<table name="area" primaryKey="ID" type="global" dataNode="dn1,dn2,dn3" />
		<table name="employee" primaryKey="id" dataNode="dn1,dn2"
			rule="sharding-by-intfile" />
		<table name="customer" dataNode="dn1,dn2" rule="auto-sharding-long2">
			<childTable name="orders" joinKey="customer_id" parentKey="id">
				<childTable name="order_items" joinKey="order_id"
					parentKey="id" />
			</childTable>
			<childTable name="customer_addr" joinKey="customer_id"
				parentKey="id" />
		</table>
		<table name="globalsn" primaryKey="ID" type="global" dataNode="dn1" />
        <table name="offer" primaryKey="id" dataNode="offer_dn$1-20"
               rule="auto-sharding-rang-mod" />

        <table name="offer1" primaryKey="id" dataNode="offer_dn$1-36"
               rule="rangeDateHash" />
	</schema>

    <schema name="mysqldb"  sqlMaxLimit="100">
        <table name="offer" dataNode="dn1,dn2" rule="auto-sharding-long2" />
		<table name="autoslot" dataNode="dn1,dn2" rule="crc32slot" />
        <table name="offer1" dataNode="dn1" />
    </schema>
    <schema name="oracledb"  sqlMaxLimit="100">
        <table name="offer" dataNode="d_oracle1,d_oracle2" rule="auto-sharding-long2" />
        <table name="offer1" dataNode="d_oracle1" />
    </schema>

	<schema name="db2db"  sqlMaxLimit="100">
		<table name="offer" dataNode="db2_1,db2_2" rule="auto-sharding-long2" />
		<table name="offer1" dataNode="db2_1" />
	</schema>


	<schema name="sqlserverdb"  sqlMaxLimit="100">
		<table name="offer" dataNode="sqlserver_1,sqlserver_2" rule="auto-sharding-long2" />
		<table name="offer1" dataNode="sqlserver_1" />
	</schema>


	<schema name="pgdb"  sqlMaxLimit="100">
		<table name="offer" dataNode="pg_1,pg_2" rule="auto-sharding-long2" />
		<table name="offer1" dataNode="pg_1" />
	</schema>
	
	<schema name="subQueries" sqlMaxLimit="100">
		<table name="table_0" dataNode="dn1,dn2" type="global"/><!-- 全局表    -->
		<table name="table_1" dataNode="dn1"/>          <!-- 非分片表 -->
		<table name="subtest1" dataNode="dn1,dn2" rule="mod-long" />
		<table name="subtest2" dataNode="dn1,dn2,dn3" rule="auto-sharding-long" />
		<table name="subtest3" dataNode="dn2,dn3" rule="mod-long" />
		<table name="subtest4" dataNode="dn1,dn2" rule="mod-long" />
	</schema>

	<dataNode name="dn1" dataHost="localhost1" database="db1" />
	<dataNode name="dn2" dataHost="localhost1" database="db2" />
	<dataNode name="dn3" dataHost="localhost1" database="db3" />
	<dataNode name="cndb_dn" dataHost="localhost1" database="db4" />
	<dataNode name="offer_dn$0-127" dataHost="localhost1" database="db1$0-127" />
	<dataNode name="detail_dn$0-127" dataHost="localhost1" database="db2$0-127" />
    <dataNode name="test_wild1$1-3" dataHost="localhost$1-3" database="db1" />
    <dataNode name="test_wild$1-6" dataHost="localhost$1-3" database="db1$1-2" />
	<dataNode name="independent_dn$0-127" dataHost="localhost1"
		database="db7_$0-127" />
	<dataNode name="dubbo_dn" dataHost="localhost1" database="db8" />
	<dataNode name="solo1" dataHost="localhost1" database="db9" />

    <dataNode name="d_oracle1" dataHost="oracle1" database="base" />
    <dataNode name="d_oracle2" dataHost="oracle2" database="bwg" />

	<dataNode name="db2_1" dataHost="db21" database="base" />
	<dataNode name="db2_2" dataHost="db22" database="test" />

	<dataNode name="sqlserver_1" dataHost="ms1" database="base" />
	<dataNode name="sqlserver_2" dataHost="ms2" database="test" />

	<dataNode name="pg_1" dataHost="pg1" database="base" />
	<dataNode name="pg_2" dataHost="pg2" database="test" />

	<dataHost name="localhost1" maxCon="500" minCon="10" balance="0"
		dbType="mysql" dbDriver="native">
		<heartbeat>select user()</heartbeat>
		<!-- can have multi write hosts -->
		<writeHost host="hostM1" url="localhost:3306" user="root"
			password="123456">
			<!-- can have multi read hosts -->
			<!-- <readHost host="hostS1" url="localhost:3307" user="root" password="123456" 
				/> -->
		</writeHost>
	</dataHost>
    <dataHost name="localhost2" maxCon="500" minCon="10" balance="0"
              dbType="mysql" dbDriver="native">
        <heartbeat>select user()</heartbeat>
        <!-- can have multi write hosts -->
        <writeHost host="hostM2" url="localhost:3306" user="root"
                   password="123456">
            <!-- can have multi read hosts -->
            <!-- <readHost host="hostS1" url="localhost:3307" user="root" password="123456"
                /> -->
        </writeHost>
    </dataHost>
    <dataHost name="localhost3" maxCon="500" minCon="10" balance="0"
              dbType="mysql" dbDriver="native">
        <heartbeat>select user()</heartbeat>
        <!-- can have multi write hosts -->
        <writeHost host="hostM3" url="localhost:3306" user="root"
                   password="123456">
            <!-- can have multi read hosts -->
            <!-- <readHost host="hostS1" url="localhost:3307" user="root" password="123456"
                /> -->
        </writeHost>
    </dataHost>


    <dataHost name="oracle1" maxCon="1000" minCon="1" balance="0" writeType="0" dbType="oracle" dbDriver="jdbc">
        <heartbeat>select 1 from dual</heartbeat>
        <connectionInitSql>alter session set nls_date_format='yyyy-mm-dd hh24:mi:ss'</connectionInitSql>
        <writeHost host="ohostM1" url="jdbc:oracle:thin:@127.0.0.1:1521:nange" user="base" password="123456" >
        </writeHost>
    </dataHost>

    <dataHost name="oracle2" maxCon="1000" minCon="1" balance="0" writeType="0" dbType="oracle" dbDriver="jdbc">
        <heartbeat>select 1 from dual</heartbeat>
        <connectionInitSql>alter session set nls_date_format='yyyy-mm-dd hh24:mi:ss'</connectionInitSql>
        <writeHost host="ohostM2" url="jdbc:oracle:thin:@127.0.0.1:1521:nange" user="bwg" password="123456" >
        </writeHost>
    </dataHost>


	<dataHost name="db21" maxCon="1000" minCon="1" balance="0" writeType="0" dbType="db2" dbDriver="jdbc">
		<heartbeat>select 1 from SYSIBM.SYSDUMMY1</heartbeat>
		<writeHost host="dhostM1" url="jdbc:db2://127.0.0.1:50000/base" user="db2inst1" password="123" >
		</writeHost>
	</dataHost>


	<dataHost name="db22" maxCon="1000" minCon="1" balance="0" writeType="0" dbType="db2" dbDriver="jdbc">
		<heartbeat>select 1 from SYSIBM.SYSDUMMY1</heartbeat>
		<writeHost host="dhostM2" url="jdbc:db2://127.0.0.1:50000/test" user="db2inst1" password="123" >
		</writeHost>
	</dataHost>



	<dataHost name="ms1" maxCon="1000" minCon="1" balance="0" writeType="0" dbType="sqlserver" dbDriver="jdbc">
		<heartbeat>select 1 </heartbeat>
		<writeHost host="mhostM1" url="jdbc:sqlserver://127.0.0.1:1433;DatabaseName=base" user="base" password="123" >
		</writeHost>
	</dataHost>

	<dataHost name="ms2" maxCon="1000" minCon="1" balance="0" writeType="0" dbType="sqlserver" dbDriver="jdbc">
		<heartbeat>select 1 </heartbeat>
		<writeHost host="mhostM2" url="jdbc:sqlserver://127.0.0.1:1433;DatabaseName=test" user="base" password="123" >
		</writeHost>
	</dataHost>
	<dataHost name="pg1" maxCon="1000" minCon="1" balance="0" writeType="0" dbType="postgresql" dbDriver="jdbc">
		<heartbeat>select 1</heartbeat>
		<writeHost host="phostM1" url="jdbc:postgresql://127.0.0.1:5432/base" user="test" password="123" >
		</writeHost>
	</dataHost>

	<dataHost name="pg2" maxCon="1000" minCon="1" balance="0" writeType="0" dbType="postgresql" dbDriver="jdbc">
		<heartbeat>select 1 </heartbeat>
		<writeHost host="phostM2" url="jdbc:postgresql://127.0.0.1:5432/test" user="test" password="123" >
		</writeHost>
	</dataHost>

</mycat:schema>
