<?xml version="1.0" encoding="UTF-8"?>
<!--
 -  
 - Licensed under the Apache License, Version 2.0 (the "License");
 - you may not use this file except in compliance with the License.
 - You may obtain a copy of the License at
 -  
 -      http://www.apache.org/licenses/LICENSE-2.0
 -  
 - Unless required by applicable law or agreed to in writing, software
 - distributed under the License is distributed on an "AS IS" BASIS,
 - WITHOUT WARRANTIES OR CONDITIONS OF ANY KIND, either express or implied.
 - See the License for the specific language governing permissions and
 - limitations under the License.
-->
<!DOCTYPE mycat:schema SYSTEM "schema.dtd">
<mycat:schema xmlns:mycat="http://io.mycat/">

  <!-- schema定义 -->
  <schema name="dbtest">
    <table name="tb2" dataNode="dnTest2,dnTest3" rule="rule1" />
  </schema>
  
  <schema name="dbtest1">    
   	<!-- 动态日期表设置, 格式： yyyymm,年,月,往后月数 -->
	<!-- 动态日期表设置, 格式： yyyymmdd,年,月,日,wanghou天数 -->
	<table name="dynamic_" nameSuffix="yyyymmdd,2015,08,01,15" dataNode="dnTest2,dnTest3" />
	<table name="dynamic_" nameSuffix="yyyymm,2015,01,15" dataNode="dnTest2,dnTest3" />
  </schema>
  
  <schema name="dbtest2" checkSQLschema="false" sqlMaxLimit="100" dataNode="dnTest4"></schema>


  <!-- 数据节点定义，数据节点由数据源和其他一些参数组织而成。 -->
  <dataNode name="dnTest1" dataHost="localhost1" database="db1" /> 
  <dataNode name="dnTest2" dataHost="localhost1" database="db2" />
  <dataNode name="dnTest3" dataHost="localhost1" database="db3" />
  <dataNode name="dnTest4" dataHost="localhost2" database="db4" />
  
  <dataHost name="localhost1" maxCon="500" minCon="10" balance="0"
		dbType="mysql" dbDriver="native" >
		<heartbeat>select user()</heartbeat>
		<!-- can have multi write hosts -->
		<writeHost host="hostM1" url="localhost:3306" user="root"
			password="123456">
			<!-- can have multi read hosts -->
			<!-- <readHost host="hostS1" url="localhost:3307" user="root" password="123456" 
				/> -->
		</writeHost>
	</dataHost>


	<!-- 读权重设置 -->
	<dataHost name="localhost2" maxCon="1000" minCon="10" balance="0"
		writeType="0" dbType="mysql" dbDriver="native" switchType="1"  slaveThreshold="100" tempReadHostAvailable="1">
		<heartbeat>select user()</heartbeat>		
		<writeHost host="writeS" url="192.168.1.10:3306" user="root" password="123456" >
			<!-- can have multi read hosts -->
			<readHost host="readS1" url="192.168.1.11:3306" user="root" password="123456" weight="1" />
			<readHost host="readS2" url="192.168.1.12:3306" user="root" password="123456" weight="2"/>
			<readHost host="readS3" url="192.168.1.13:3306" user="root" password="123456" weight="3"/>
		</writeHost>		
	</dataHost>
 
</mycat:schema>
